Name,Source,Page,Type,Properties,Weight,Value,Text
Icewind Dale Trinket,IDRotF,263,adventuring gear,,,,"Icewind Dale Trinketsd100Trinket01-04A small wooden figurine of a yawning walrus, painted in red and black05-08A pair of scrimshaw cufflinks with an image of a fisherman on a boat engraved on them09-12A small iron key with a frayed blue and gold cord tied to it13-16A small illustrated book of Northlander myths that has pages missing17-20A damaged scrimshaw cameo depicting a merfolk21-24A stone from a burial cairn with a tiny Dwarvish rune carved into it25-28A ripped cloth sail with a symbol you don't recognize29-32An Ulu knife with a scrimshaw handle33-36A jar containing an unidentifiable, sweet, sticky substance37-40A delicate glass ball painted with snowflakes, capped by a metal loop with a tiny hook attached to it41-44An expedition log with missing pages and a pressed flower used as a bookmark45-48An owl figurine carved from whalebone49-52A sewing box that smells of old wood and has three spools of blue thread inside53-56A scrimshaw-handled ink pen with black runic designs along its length57-60A brooch made from a small insect encased in amber61-64A scrimshaw pepper shaker etched with the letter W65-68An old, wooden-handled ice pick stained with blood that won't wash off69-72A fabric doll bearing an angry expression73-76A set of wind chimes made from seashells77-80A beautiful silver tin that, when opened, emits the smell of rotting fish81-84A bloodstained dreamcatcher made from fishing line, gold wire, and snowy owlbear feathers85-88A figurine of a polar bear made of ice that never melts89-92A snow globe that doesn't need to be shaken93-96A piece of sea glass shaped like a unicorn's horn97-00A dark blue scarf that gets lighter in shade the higher the altitude of the wearer"
Ink (1-ounce bottle),PHB,150,adventuring gear,,,10 gp,Ink (1-ounce bottle)
Ink Pen,PHB,150,adventuring gear,,,2 cp,
Insect Repellent (block of incense),ToA,32,adventuring gear,,,1 sp,"Insect repellent can be purchased in Port Nyanzaru in two forms: blocks of incense or a greasy salve. The merchant prince Kwayothe controls the sale of both. Neither kind of repellent protects against giant insects or the vile swarms of insects described in appendix A of the Monster Manual.When lit, it burns for 8 hours and repels normal insects within a 20-foot-radius centered on it."
Insect Repellent (greasy salve),ToA,32,adventuring gear,,,1 gp,Insect repellent can be purchased in Port Nyanzaru in two forms: blocks of incense or a greasy salve. The merchant prince Kwayothe controls the sale of both. Neither kind of repellent protects against giant insects or the vile swarms of insects described in appendix A of the Monster Manual.A gourd or vial of salve contains 20 applications of odorless grease. One application protects its wearer against normal insects for 24 hours. The salve is waterproof so it doesn't wash off in rain.
Iron,PHB,157,trade good,,1 lb.,1 sp,"Most wealth is not in coins. It is measured in livestock, grain, land, rights to collect taxes, or rights to resources (such as a mine or a forest).Guilds, nobles, and royalty regulate trade. Chartered companies are granted rights to conduct trade along certain routes, to send merchant ships to various ports, or to buy or sell specific goods. Guilds set prices for the goods or services that they control, and determine who may or may not offer those goods and services. Merchants commonly exchange trade goods without using currency."
Iron Pot,PHB,153,adventuring gear,,10 lb.,2 gp,An iron pot holds 1 gallon of liquid.
Iron Spike,PHB,150,adventuring gear,,½ lb.,1 sp,
Iron Spikes (10),PHB,150,adventuring gear,,5 lb.,1 gp,
Javelin,PHB,149,"weapon, simple weapon, melee weapon","1d6, piercing, - thrown (30/120 ft.)",2 lb.,5 sp," Thrown. If a weapon has the thrown property, you can throw the weapon to make a ranged attack. If the weapon is a melee weapon, you use the same ability modifier for that attack roll and damage roll that you would use for a melee attack with the weapon. For example, if you throw a handaxe, you use your Strength, but if you throw a dagger, you can use either your Strength or your Dexterity, since the dagger has the finesse property."
Jeweler's Tools,PHB,154,artisan's tools,,2 lb.,25 gp,"These special tools include the items needed to pursue a craft or trade. Proficiency with a set of artisan's tools lets you add your proficiency bonus to any ability checks you make using the tools in your craft. Each type of artisan's tools requires a separate proficiency.Training with jeweler's tools includes the basic techniques needed to beautify gems. It also gives you expertise in identifying precious stones. Components. Jeweler's tools consist of a small saw and hammer, files, pliers, and tweezers. Arcana. Proficiency with jeweler's tools grants you knowledge about the reputed mystical uses of gems. This insight proves handy when you make Arcana checks related to gems or gem-encrusted items. Investigation. When you inspect jeweled objects, your proficiency with jeweler's tools aids you in picking out clues they might hold. Identify Gems. You can identify gems and determine their value at a glance.Jeweler's ToolsActivityDCModify a gem's appearance15Determine a gem's history20See the Tool Proficiencies entry for more information."
Jug,PHB,153,adventuring gear,,4 lb.,2 cp,A jug holds 1 gallon of liquid.
Keelboat,DMG,119,vehicle (water),"Speed: 1 mphCarrying Capacity: 1/2 ton cargo, 6 passengersCrew 1, AC 15, HP 100, Damage Threshold 10",,"3,000 gp","Keelboats and rowboats are used on lakes and rivers. If going downstream, add the speed of the current (typically 3 miles per hour) to the speed of the vehicle. These vehicles can't be rowed against any significant current, but they can be pulled upstream by draft animals on the shores. Crew. A ship needs a crew of skilled hirelings to function. As per the Player's Handbook, one skilled hireling costs at least 2 gp per day. The minimum number of skilled hirelings needed to crew a ship depends on the type of vessel.You can track the loyalty of individual crew members or the crew as a whole using the optional loyalty rules in chapter 4 of the Dungeon Master's Guide. If at least half the crew becomes disloyal during a voyage, the crew turns hostile and stages a mutiny. If the ship is berthed, disloyal crew members leave the ship and never return. Passengers. This indicates the number of Small and Medium passengers the ship can accommodate.Accommodations consist of shared hammocks in tight quarters. A ship outfitted with private accommodations can carry one-fifth as many passengers.A passenger is usually expected to pay 5 sp per day for a hammock, but prices can vary from ship to ship. A small private cabin usually costs 2 gp per day. Cargo. The maximum tonnage the ship can carry. Damage Threshold. If a ship has a Damage Threshold, it has immunity to all damage unless it takes an amount of damage equal to or greater than its damage threshold, in which case it takes damage as normal. Any damage that fails to meet or exceed the damage threshold is considered superficial and doesn't reduce the ship's hit points. Ship Repair. Repairs to a damaged ship can be made while the vessel is berthed. Repairing 1 hit point of damage requires 1 day and costs 20 gp for materials and labor."
Keg of Alchemist's Fire,LoX,35,adventuring gear,,,,"A keg of alchemist's fire lobbed at a creature or an object deals 21 (6d6) fire damage on a hit. Further, the target is set ablaze and takes the damage again every round (in the case of a creature, at the start of each of its turns) until the fire is put out. A creature within reach of the blaze can take an action to smother the flames using a blanket or carpet, reducing the fire damage by 2d6. Three such actions are needed to fully put out the fire."
Khyber Trinket,ERLW,135,adventuring gear,,,,"Trinkets from Khyberd10Trinket1A pressed flower with vivid green petals; when you smell it, you hear eerie music2A tiny ball of putty; if you set it down, it begins to slowly crawl around3A perpetually warm disk of dark iron4A small journal with leathery pages; any words you write in it slowly disappear5A four-sided die carved with strange markings6A cameo with the silhouette of an unknown species7A preserved finger with purple flesh and four joints8A perfectly preserved eye; if you set it down, it rotates to follow your movement9A small box; when opened, you alone hear screaming10A preserved insect; you've never seen another like it"
Ladder (10-foot),PHB,150,adventuring gear,,25 lb.,1 sp,Ladder (10-foot)
Lamp,PHB,152,adventuring gear,,1 lb.,5 sp,"A lamp casts bright light in a 15-foot radius and dim light for an additional 30 feet. Once lit, it burns for 6 hours on a flask (1 pint) of oil."
Lamprey Ship,AAG,34,vehicle (space),"Speed: 4 mphCarrying Capacity: 6 tons cargoCrew 15, AC 15, HP 250, Damage Threshold 15",,"20,000 gp","Lamprey ships are antiquated, being among the oldest spelljamming ships still in use. Psurlons (see Boo's Astral Menagerie) are particularly fond of them.Using the metal grappling jaws built into its bow, a lamprey ship can attach itself to another ship, which is a critical feature during boarding actions. Other standard weapons include four ballistae on the main deck.A lamprey can float on water, though it can't land safely on the ground. Lamprey ships that land on the ground have the distressing habit of rolling over, as more than a few crews have discovered to their dismay."
Lance,PHB,149,"weapon, martial weapon, melee weapon","1d12, piercing, - reach, special",6 lb.,10 gp," Special. You have disadvantage when you use a lance to attack a target within 5 feet of you. Also, a lance requires two hands to wield when you aren't mounted. Reach. This weapon adds 5 feet to your reach when you attack with it. This property also determines your reach for opportunity attacks with a reach weapon."
Leather Armor,PHB,144,light armor,AC 11 + Dex,10 lb.,10 gp,The breastplate and shoulder protectors of this armor are made of leather that has been stiffened by being boiled in oil. The rest of the armor is made of softer and more flexible materials.
Leatherworker's Tools,PHB,154,artisan's tools,,5 lb.,5 gp,"These special tools include the items needed to pursue a craft or trade. Proficiency with a set of artisan's tools lets you add your proficiency bonus to any ability checks you make using the tools in your craft. Each type of artisan's tools requires a separate proficiency.Knowledge of leatherworking extends to lore concerning animal hides and their properties. It also confers knowledge of leather armor and similar goods. Components. Leatherworker's tools include a knife, a small mallet, an edger, a hole punch, thread, and leather scraps. Arcana. Your expertise in working with leather grants you added insight when you inspect magic items crafted from leather, such as boots and some cloaks. Investigation. You gain added insight when studying leather items or clues related to them, as you draw on your knowledge of leather to pick out details that others would overlook. Identify Hides. When looking at a hide or a leather item, you can determine the source of the leather and any special techniques used to treat it. For example, you can spot the difference between leather crafted using dwarven methods and leather crafted using halfling methods.Leatherworker's ToolsActivityDCModify a leather item's appearance10Determine a leather item's history20See the Tool Proficiencies entry for more information."
Light Crossbow,PHB,149,"weapon, simple weapon, ranged weapon","1d8, piercing, - ammunition (80/320 ft.), loading, two-handed",5 lb.,25 gp," Range. A weapon that can be used to make a ranged attack has a range shown in parentheses after the ammunition or thrown property. The range lists two numbers. The first is the weapon's normal range in feet, and the second indicates the weapon's maximum range. When attacking a target beyond normal range, you have disadvantage on the attack roll. You can't attack a target beyond the weapon's long range. Ammunition. You can use a weapon that has the ammunition property to make a ranged attack only if you have ammunition to fire from the weapon. Each time you attack with the weapon, you expend one piece of ammunition. Drawing the ammunition from a quiver, case, or other container is part of the attack. Loading a one-handed weapon requires a free hand. At the end of the battle, you can recover half your expended ammunition by taking a minute to search the battlefield.If you use a weapon that has the ammunition property to make a melee attack, you treat the weapon as an improvised weapon. A sling must be loaded to deal any damage when used in this way. Loading. Because of the time required to load this weapon, you can fire only one piece of ammunition from it when you use an action, bonus action, or reaction to fire it, regardless of the number of attacks you can normally make. Two-Handed. This weapon requires two hands to use. This property is relevant only when you attack with the weapon, not when you simply hold it."
Light Hammer,PHB,149,"weapon, simple weapon, melee weapon","1d4, bludgeoning, - light, thrown (20/60 ft.)",2 lb.,2 gp," Light. A light weapon is small and easy to handle, making it ideal for use when fighting with two weapons. Thrown. If a weapon has the thrown property, you can throw the weapon to make a ranged attack. If the weapon is a melee weapon, you use the same ability modifier for that attack roll and damage roll that you would use for a melee attack with the weapon. For example, if you throw a handaxe, you use your Strength, but if you throw a dagger, you can use either your Strength or your Dexterity, since the dagger has the finesse property."
Linen (1 sq. yd.),PHB,157,trade good,,,5 gp,"Most wealth is not in coins. It is measured in livestock, grain, land, rights to collect taxes, or rights to resources (such as a mine or a forest).Guilds, nobles, and royalty regulate trade. Chartered companies are granted rights to conduct trade along certain routes, to send merchant ships to various ports, or to buy or sell specific goods. Guilds set prices for the goods or services that they control, and determine who may or may not offer those goods and services. Merchants commonly exchange trade goods without using currency."
Living Ship,AAG,36,vehicle (space),"Speed: 4½ mphCarrying Capacity: 10 tons cargoCrew 5, AC 15, HP 250, Damage Threshold 15",,"25,000 gp","Druids, rangers, and clerics devoted to gods of nature are often found aboard living ships, as are Wildspace explorers who don't want to have to worry about their ship's air envelope becoming fouled during a long voyage.This ship's main distinctive feature is the fully grown treant on the aft deck. The treant has a speed of 0 because its roots are woven into the deck; it and the ship are inseparable. If the ship is reduced to 0 hit points, the treant dies of shock. The ship can function if its treant dies, but the treant can never be replaced with another.When the treant finishes a long rest, it repairs the ship's hull, enabling the ship to regain 4d12 hit points, and refreshes the ship's air envelope (turning deadly air into foul air, or foul air into fresh air).A living ship can float on water and sail across it, but it can't land safely on the ground (its keel would cause it to roll on its side). Its standard weaponry is an aft-mounted ballista."
Loaf of Bread,PHB,158,food and drink,,,2 cp,
Lock,PHB,152,adventuring gear,,1 lb.,10 gp,"A key is provided with the lock. Without the key, a creature proficient with thieves' tools can pick this lock with a successful DC 15 Dexterity check. Your DM may decide that better locks are available for higher prices."
Longbow,PHB,149,"weapon, martial weapon, ranged weapon","1d8, piercing, - ammunition (150/600 ft.), heavy, two-handed",2 lb.,50 gp," Range. A weapon that can be used to make a ranged attack has a range shown in parentheses after the ammunition or thrown property. The range lists two numbers. The first is the weapon's normal range in feet, and the second indicates the weapon's maximum range. When attacking a target beyond normal range, you have disadvantage on the attack roll. You can't attack a target beyond the weapon's long range. Ammunition. You can use a weapon that has the ammunition property to make a ranged attack only if you have ammunition to fire from the weapon. Each time you attack with the weapon, you expend one piece of ammunition. Drawing the ammunition from a quiver, case, or other container is part of the attack. Loading a one-handed weapon requires a free hand. At the end of the battle, you can recover half your expended ammunition by taking a minute to search the battlefield.If you use a weapon that has the ammunition property to make a melee attack, you treat the weapon as an improvised weapon. A sling must be loaded to deal any damage when used in this way. Heavy. Creatures that are Small or Tiny have disadvantage on attack rolls with heavy weapons. A heavy weapon's size and bulk make it too large for a Small or Tiny creature to use effectively. Two-Handed. This weapon requires two hands to use. This property is relevant only when you attack with the weapon, not when you simply hold it."
Longhorn,SCAG,124,instrument,,,,"A Faerûnian flute of sophisticated make, found only in areas with skilled artisans, as in great cities or elven enclaves.If you have proficiency with a given musical instrument, you can add your proficiency bonus to any ability checks you make to play music with the instrument. A bard can use a musical instrument as a spellcasting focus. Each type of musical instrument requires a separate proficiency.See the Tool Proficiencies entry for more information.Proficiency with a musical instrument indicates you are familiar with the techniques used to play it. You also have knowledge of some songs commonly performed with that instrument. History. Your expertise aids you in recalling lore related to your instrument. Performance. Your ability to put on a good show is improved when you incorporate an instrument into your act. Compose a Tune. As part of a long rest, you can compose a new tune and lyrics for your instrument. You might use this ability to impress a noble or spread scandalous rumors with a catchy tune.Musical InstrumentActivityDCIdentify a tune10Improvise a tune20"
Longship,DMG,119,vehicle (water),"Speed: 3 mphCarrying Capacity: 10 tons cargo, 150 passengersCrew 40, AC 15, HP 300, Damage Threshold 15",,"10,000 gp"," Crew. A ship needs a crew of skilled hirelings to function. As per the Player's Handbook, one skilled hireling costs at least 2 gp per day. The minimum number of skilled hirelings needed to crew a ship depends on the type of vessel.You can track the loyalty of individual crew members or the crew as a whole using the optional loyalty rules in chapter 4 of the Dungeon Master's Guide. If at least half the crew becomes disloyal during a voyage, the crew turns hostile and stages a mutiny. If the ship is berthed, disloyal crew members leave the ship and never return. Passengers. This indicates the number of Small and Medium passengers the ship can accommodate.Accommodations consist of shared hammocks in tight quarters. A ship outfitted with private accommodations can carry one-fifth as many passengers.A passenger is usually expected to pay 5 sp per day for a hammock, but prices can vary from ship to ship. A small private cabin usually costs 2 gp per day. Cargo. The maximum tonnage the ship can carry. Damage Threshold. If a ship has a Damage Threshold, it has immunity to all damage unless it takes an amount of damage equal to or greater than its damage threshold, in which case it takes damage as normal. Any damage that fails to meet or exceed the damage threshold is considered superficial and doesn't reduce the ship's hit points. Ship Repair. Repairs to a damaged ship can be made while the vessel is berthed. Repairing 1 hit point of damage requires 1 day and costs 20 gp for materials and labor."
Longsword,PHB,149,"weapon, martial weapon, melee weapon","1d8, slashing, - versatile (1d10)",3 lb.,15 gp, Versatile. This weapon can be used with one or two hands. A damage value in parentheses appears with the property—the damage when the weapon is used with two hands to make a melee attack.
Lorehold Trinket,SCC,31,adventuring gear,,,,"When you make your character, you may roll once on the Lorehold Trinkets table, instead of on the Trinkets table in the Player's Handbook, for your starting trinket.Lorehold Trinketsd6Trinket1A map made of concentric circles that can be rotated around the page2A puzzle box bedecked with amber3A dented brass compass with a red needle4The head of a broken statue that houses the consciousness of a snarky sage5A sheet of parchment embossed with tactile lettering, glowing red6A broken dagger with a wavy blade and a serpentine hilt"
Lute,PHB,154,instrument,,2 lb.,35 gp,"If you have proficiency with a given musical instrument, you can add your proficiency bonus to any ability checks you make to play music with the instrument. A bard can use a musical instrument as a spellcasting focus. Each type of musical instrument requires a separate proficiency.See the Tool Proficiencies entry for more information.Proficiency with a musical instrument indicates you are familiar with the techniques used to play it. You also have knowledge of some songs commonly performed with that instrument. History. Your expertise aids you in recalling lore related to your instrument. Performance. Your ability to put on a good show is improved when you incorporate an instrument into your act. Compose a Tune. As part of a long rest, you can compose a new tune and lyrics for your instrument. You might use this ability to impress a noble or spread scandalous rumors with a catchy tune.Musical InstrumentActivityDCIdentify a tune10Improvise a tune20"
Lyre,PHB,154,instrument,,2 lb.,30 gp,"If you have proficiency with a given musical instrument, you can add your proficiency bonus to any ability checks you make to play music with the instrument. A bard can use a musical instrument as a spellcasting focus. Each type of musical instrument requires a separate proficiency.See the Tool Proficiencies entry for more information.Proficiency with a musical instrument indicates you are familiar with the techniques used to play it. You also have knowledge of some songs commonly performed with that instrument. History. Your expertise aids you in recalling lore related to your instrument. Performance. Your ability to put on a good show is improved when you incorporate an instrument into your act. Compose a Tune. As part of a long rest, you can compose a new tune and lyrics for your instrument. You might use this ability to impress a noble or spread scandalous rumors with a catchy tune.Musical InstrumentActivityDCIdentify a tune10Improvise a tune20"
Mace,PHB,149,"weapon, simple weapon, melee weapon","1d6, bludgeoning",4 lb.,5 gp,
Magnifying Glass,PHB,152,adventuring gear,,,100 gp,"This lens allows a closer look at small objects. It is also useful as a substitute for flint and steel when starting fires. Lighting a fire with a magnifying glass requires light as bright as sunlight to focus, tinder to ignite, and about 5 minutes for the fire to ignite. A magnifying glass grants advantage on any ability check made to appraise or inspect an item that is small or highly detailed."
Malice,DMG,258,"adventuring gear, poison (inhaled)",,,250 gp,A creature subjected to this poison must succeed on a DC 15 Constitution saving throw or become poisoned for 1 hour. The poisoned creature is blinded.
Manacles,PHB,152,adventuring gear,,6 lb.,2 gp,"These metal restraints can bind a Small or Medium creature. Escaping the manacles requires a successful DC 20 Dexterity check. Breaking them requires a successful DC 20 Strength check. Each set of manacles comes with one key. Without the key, a creature proficient with thieves' tools can pick the manacles' lock with a successful DC 15 Dexterity check. Manacles have 15 hit points."
Map or Scroll Case,PHB,151,adventuring gear,,1 lb.,1 gp,This cylindrical leather case can hold up to ten rolled-up sheets of paper or five rolled-up sheets of parchment.
Mason's Tools,PHB,154,artisan's tools,,8 lb.,10 gp,"These special tools include the items needed to pursue a craft or trade. Proficiency with a set of artisan's tools lets you add your proficiency bonus to any ability checks you make using the tools in your craft. Each type of artisan's tools requires a separate proficiency.Mason's tools allow you to craft stone structures, including walls and buildings crafted from brick. Components. Mason's tools consist of a trowel, a hammer, a chisel, brushes, and a square. History. Your expertise aids you in identifying a stone building's date of construction and purpose, along with insight into who might have built it. Investigation. You gain additional insight when inspecting areas within stone structures. Perception. You can spot irregularities in stone walls or floors, making it easier to find trap doors and secret passages. Demolition. Your knowledge of masonry allows you to spot weak points in brick walls. You deal double damage to such structures with your weapon attacks.Mason's ToolsActivityDCChisel a small hole in a stone wall10Find a weak point in a stone wall15See the Tool Proficiencies entry for more information."
Mastiff,PHB,157,mount,"Speed: 40, Carrying Capacity: 195 lb.",,25 gp,
